{
  "schema_version": "0.2.7",
  "calibration_id": "calibration:reference",
  "calibrated_at": "2026-08-22T00:00:00+00:00",
  "measurement_contract": {
    "unit": "interaction_depth",
    "reliability_p": 0.9,
    "scope_id": "reference-governance-scope",
    "assessment_method": "monotone_binomial_pava_v1"
  },
  "evidence_confidence_p": 0.9,
  "minimums": {
    "min_distinct_depths": 4,
    "min_total_trials": 80,
    "min_trials_per_depth": 20
  },
  "subjects": {
    "autonomy": [
      {"depth": 4, "trials": 20, "successes": 20, "evidence_refs": ["evidence:autonomy:4"]},
      {"depth": 8, "trials": 20, "successes": 19, "evidence_refs": ["evidence:autonomy:8"]},
      {"depth": 12, "trials": 20, "successes": 18, "evidence_refs": ["evidence:autonomy:12"]},
      {"depth": 16, "trials": 20, "successes": 10, "evidence_refs": ["evidence:autonomy:16"]}
    ],
    "governance": [
      {"depth": 3, "trials": 20, "successes": 20, "evidence_refs": ["evidence:governance:3"]},
      {"depth": 6, "trials": 20, "successes": 19, "evidence_refs": ["evidence:governance:6"]},
      {"depth": 9, "trials": 20, "successes": 18, "evidence_refs": ["evidence:governance:9"]},
      {"depth": 12, "trials": 20, "successes": 10, "evidence_refs": ["evidence:governance:12"]}
    ]
  }
}
